"Keyword","Intent","Difficulty","Search Volume","Competition Level","CPC","SERP","Updated"
"scam website checker","Informational","75","1600","High","1.89","Organic, Related Searches","2026-05-20 08:44:54 +00:00"
"scam checker","Informational","53","880","Medium","1.94","Organic, Related Searches","2026-05-22 11:08:55 +00:00"
"scam phone number checker","Informational","41","590","Medium","1.11","Organic, People Also Ask, Related Searches","2026-04-14 18:11:09 +00:00"
"scam email checker","Informational","29","390","Low","1.61","Organic, People Also Ask, Related Searches","2026-05-20 07:01:45 +00:00"
"scam site checker","Commercial","57","260","Medium","1.38","Organic, Video, Related Searches, Images","2026-05-20 14:14:03 +00:00"
"scam link checker","Informational","50","210","Medium","0.77","Organic, Short Videos, Related Searches","2026-04-16 21:26:51 +00:00"
"scam call checker","Informational","21","170","Low","0.53","Organic, People Also Ask, Related Searches","2026-03-11 08:15:44 +00:00"
"scam checker australia","Navigational","39","90","Low","4.69","Organic, People Also Ask, Related Searches","2026-05-20 13:56:34 +00:00"
"scam website checker australia","Informational","62","50","Medium","1.88","Organic, Related Searches","2026-04-19 16:14:42 +00:00"
"scam url checker","Informational","0","30","Low","0.61","-","2026-04-14 06:07:51 +00:00"
"scam call number checker","Informational","0","20","Low","1.15","-","2026-05-20 16:02:38 +00:00"
"crypto scam checker","Commercial","0","20","Low","0","-","2026-04-18 16:57:33 +00:00"
"scam checker online free","Informational","0","10","Low","0","-","2026-05-19 07:44:57 +00:00"
"scam link checker online","Informational","0","10","Low","0","-","2026-05-22 11:43:36 +00:00"
"online store scam checker","Informational","0","10","Low","0","-","2026-05-20 04:24:44 +00:00"
"online scam checker","Commercial","0","10","Low","4.57","-","2026-05-20 21:29:17 +00:00"
"scam call checker online free","Informational","0","10","Low","0","-","2026-04-15 18:08:25 +00:00"
"website scam checker reddit","Informational","0","10","Low","0","-","2026-05-21 06:28:55 +00:00"
"scam website checker uk","Informational","0","10","Low","0","-","2026-04-15 11:48:55 +00:00"
"google scam checker","Navigational","0","10","Low","0","-","2026-05-19 07:44:40 +00:00"
"scam message checker","Informational","0","10","Low","0","-","2026-04-18 13:53:55 +00:00"
"facebook scam checker","Navigational","0","10","Low","0","-","2026-05-20 09:15:00 +00:00"
"shopping website scam checker","Commercial","0","10","Low","0","-","2026-05-22 02:27:09 +00:00"
"scam text checker","Informational","0","10","Low","0","-","2026-05-20 22:18:06 +00:00"
"free scam call checker","Informational","0","10","Low","0","-","2026-04-17 05:09:01 +00:00"
"scam call checker online","Informational","0","10","Low","0","-","2026-04-18 21:48:41 +00:00"
"is this link a scam checker","Informational","0","10","Low","0","-","2026-05-20 10:32:38 +00:00"
"is this a scam number checker free","Informational","0","10","Low","0.55","-","2026-05-20 21:05:36 +00:00"
"text scam checker","-","0","10","Low","0","-","2026-05-20 18:41:33 +00:00"
"roblox scam link checker","Informational","0","10","Low","0","-","2026-05-22 07:12:49 +00:00"
"website scam checker google","Informational","0","10","Low","0","-","2026-05-21 19:43:55 +00:00"
"scam site checker online","Informational","0","10","Low","0","-","2026-04-17 18:27:06 +00:00"
"scam instagram account checker","Navigational","0","10","Low","0","-","2026-04-15 15:21:30 +00:00"
"is this email a scam checker","Informational","0","10","Low","0","-","2026-04-18 03:46:37 +00:00"
"free scam checker","Informational","0","10","Low","1.06","-","2026-04-15 06:25:44 +00:00"
"free website scam checker","Informational","0","10","Low","0.42","-","2026-05-22 12:53:16 +00:00"
"is this a scam number checker online","Informational","0","10","Low","0","-","2026-05-20 21:06:55 +00:00"
"business scam checker","Informational","0","10","Low","0","-","2026-05-21 11:35:52 +00:00"
"best scam website checker","Commercial","0","10","Low","0","-","2026-05-22 03:34:49 +00:00"
"scam site checker reddit","Navigational","0","10","Low","0","-","2026-05-19 00:52:32 +00:00"
"app scam checker","Navigational","0","10","Low","0","-","2026-05-19 07:44:49 +00:00"
"scam number checker ireland","Informational","0","10","Low","0","-","2026-05-19 09:20:08 +00:00"
"online scam website checker","Informational","0","10","Low","1.43","-","2026-05-22 02:46:48 +00:00"
"scam detector website checker","Commercial","0","10","Low","0","-","2026-04-18 13:56:54 +00:00"
"scam or legit website checker","Informational","0","10","Low","0","-","2026-04-19 03:39:53 +00:00"
"scam phone number checker free","Informational","0","0","Low","0","-","2026-05-20 01:26:56 +00:00"
"scam phone number checker malaysia","Informational","0","0","Low","0","-","2026-04-17 14:00:50 +00:00"